{
  "$schema": "https://json-schema.org/draft/2020-12/schema",
  "$id": "https://schemas.oneclick2d.invalid/gate-f-candidate-baseline/v0.1/config.schema.json",
  "title": "OneClick2D Gate F Deterministic Candidate Baseline Config v0.1",
  "type": "object",
  "additionalProperties": false,
  "required": ["format", "format_version", "profile_id", "required_pillow_version", "frame_sequence"],
  "properties": {
    "format": {"const": "oneclick2d.candidate-baseline-config"},
    "format_version": {"const": "0.1.0"},
    "profile_id": {"const": "oc2d.spike.candidate-baseline.fixed-regions.v1"},
    "required_pillow_version": {"const": "12.1.0"},
    "frame_sequence": {"$ref": "../../gate-f-frame-sequence/v0.1/config.schema.json"}
  }
}
